bases_id,title,public_url,description,keywords,author,og_title,og_type,og_url,og_image,og_site_name,og_description
922,ULTRAMAN,https://anime.heros-ultraman.com/,アニメ『ULTRAMAN』 2019年4月1日、Netflixにて世界同時独占配信開始！ 監督：神山健治×荒牧伸志、制作：Production I.G×SOLA DIGITAL ARTS,"ULTRAMAN.ウルトラマン,清水栄一,下口智裕,神山健治,荒牧伸志,ヒーローズ,HEROS,アニメ",,ULTRAMANアニメ公式サイト,website,https://anime.heros-ultraman.com/,https://anime.heros-ultraman.com/wp/wp-content/themes/anime_heros_ultraman/assets/images/common/ogp_2.png,ULTRAMANアニメ公式サイト,アニメ『ULTRAMAN』 2019年4月1日、Netflixにて世界同時独占配信開始！ 監督：神山健治×荒牧伸志、制作：Production I.G×SOLA DIGITAL ARTS
923,爆丸バトルプラネット,https://www.tv-tokyo.co.jp/anime/bakugan-bp/,テレビ東京系6局ネットにて毎週月曜夕方5時55分～好評放送中！　爆丸バトルプラネットのテレビ東京アニメ公式サイトです。最新情報やストーリー、キャラクター紹介や次回予告などを掲載しています。,"爆丸バトルプラネット,爆丸,ばくがん,モンスター,バトル,オーサムワン,ダン,ドラゴ,スピンマスター,Man of Action,テレビ東京,あにてれ,アニメ,公式",,爆丸バトルプラネット　テレビ東京アニメ公式,website,https://www.tv-tokyo.co.jp/anime/bakugan-bp/,https://www.tv-tokyo.co.jp/anime/bakugan-bp/images/facebook_icon.jpg,,
924,ダイヤのA actII,https://diaace.com/index.html,,,,,tv,http://www.diaace.com,http://www.diaace.com/diaace.png,TVアニメ「ダイヤのA」スペシャルサイト,TVアニメ「ダイヤのA」スペシャルサイト
925,アイドルマスター シンデレラガールズ劇場 CLIMAX SEASON,http://cingeki-anime.com/,ＴＶアニメ「シンデレラガールズ劇場」の公式サイトです。,"アニメ,でれげき,シンデレラガールズ,シンデレラガールズ劇場,アイドルマスター,デレマス,アイマス,デレゲキ,デレ劇",,ＴＶアニメ「シンデレラガールズ劇場」　公式サイト,website,http://cingeki-anime.com/,http://cingeki-anime.com/lib/images/ogp.png,ＴＶアニメ「シンデレラガールズ劇場」　公式サイト,ＴＶアニメ「シンデレラガールズ劇場」の公式サイトです。
926,この世の果てで恋を唄う少女YU-NO,http://yuno-anime.com/,あの伝説のアドベンチャーゲームがついにアニメ化決定！AT-X、TOKYO MXほかにて2019年4月2日(火)より放送開始！,"MAGES.,feel.,GENCO,YU-NO,ユーノ,菅野ひろゆき,林勇,小澤亜李,釘宮理恵,内田真礼,大西沙織,釘宮理恵,小林ゆう,前田玲奈,名塚佳織,楠大典,藤原祐規,江口拓",,TVアニメ「この世の果てで恋を唄う少女YU-NO」公式サイト,website,http://yuno-anime.com/,http://yuno-anime.com/wp/wp-content/themes/yunoanime/img/ogimage3.jpg,TVアニメ「この世の果てで恋を唄う少女YU-NO」公式サイト,あの伝説のアドベンチャーゲームがついにアニメ化決定！AT-X、TOKYO MXほかにて2019年4月2日(火)より放送開始！
927,猫のニャッホ,https://niagho.com/info/tvanime.html,猫のニャッホアニメ2019年4月3日（水）スタート！テレビ東京系「きんだーてれび」にて毎週水曜日朝7:30から,"猫,パズル,ニャッホ,ゴッホ,にゃんこ,ネコ,ねこ,ゲーム,スリーマッチ,マッチスリー,手描き,アプリ,App,iOS,Android,フランス,パリ,画家,芸術,美術,絵画,爽快,癒し,簡単,杉田智和,嘉陽光,板垣優稀,橘諒,相馬優,前川綾香",,【公式】猫のニャッホ 〜ニャ・ミゼラブル〜,website,https://niagho.com,https://niagho.com/img/og_official.png,【公式】猫のニャッホ 〜ニャ・ミゼラブル〜,猫のニャッホアニメ2019年4月3日（水）スタート！テレビ東京系「きんだーてれび」にて毎週水曜日朝7:30から
928,アイカツフレンズ！～かがやきのジュエル～,https://www.tv-tokyo.co.jp/anime/aikatsufriends/,テレビ東京系で毎週木曜夕方6:25～好評放送中！　アイカツフレンズ！のテレビ東京アニメ公式サイトです。最新の情報、ストーリー、キャラクター、スタッフ・キャストなどの情報を掲載しています。,"アイカツフレンズ！,アイカツ,アイドル活動,アイカツ フレンズ,テレビ東京,あにてれ,アニメ,公式",,アイカツフレンズ！　テレビ東京アニメ公式,website,https://www.tv-tokyo.co.jp/anime/aikatsufriends/,https://www.tv-tokyo.co.jp/anime/aikatsufriends/images/facebook_icon.jpg,,
929,八十亀ちゃんかんさつにっき,https://yatogame.nagoya/,"東京育ちの高校生、陣界斗（じんかいと）が転校した先の名古屋で出会ったのは方言丸出しの女子高生「八十亀最中」（やとがめもなか）だった。ネコのような風貌と露骨な名古屋弁を操る八十亀ちゃんは全然懐いてくれず…。かわいい八十亀ちゃんを観察し、名古屋の地位を向上させる、大人気局地コメディ!!がアニメ化 やとがめちゃんかんさつにっき,やとがめちゃん,はちじゅっかめ","やとがめちゃんかんさつにっき,やとがめちゃん,はちじゅっかめ",,TVアニメ「八十亀ちゃんかんさつにっき」,website,https://yatogame.nagoya/,https://yatogame.nagoya/wp-content/uploads/2019/02/20190208_OGP_img.jpg,八十亀ちゃんかんさつにっき,東京育ちの高校生、陣界斗（じんかいと）が転校した先の名古屋で出会ったのは方言丸出しの女子高生「八十亀最中」（やとがめもなか）だった。ネコのような風貌と露骨な名古屋弁を操る八十亀ちゃんは全然懐いてくれず…。かわいい八十亀ちゃんを観察し、名古屋の地位を向上させる、大人気局地コメディ!!がアニメ化
930,叛逆性ミリオンアーサー(第2シーズン),http://hangyakusei-anime.com/,TVアニメ『叛逆性ミリオンアーサー』公式サイト 4月4日（木）より第2シーズン放送スタート！,"ミリアサアニメ,叛逆性,叛逆性アニメ,アニメ叛逆性ミリオンアーサー ",,TVアニメ「叛逆性ミリオンアーサー」公式サイト,website,http://hangyakusei-anime.com/,http://hangyakusei-anime.com/core_sys/images/others/ogp2.jpg,TVアニメ「叛逆性ミリオンアーサー」公式サイト,TVアニメ『叛逆性ミリオンアーサー』公式サイト 4月4日（木）より第2シーズン放送スタート！
931,BAKUMATSUクライシス,http://www.tbs.co.jp/anime/BAKUMATSU/,"TVアニメ「BAKUMATSUクライシス」の公式サイトです。TBS,BS-TBSにて2019年4月4日放送開始","BAKUMATSUクライシス,BAKUMATSU,バククラ,アニメ",TBS,TVアニメ「BAKUMATSUクライシス」公式ホームページ｜TBSテレビ,tv_show,https://www.tbs.co.jp/anime/BAKUMATSU/,https://www.tbs.co.jp/anime/BAKUMATSU/img/ogp.jpg,TBSテレビ,"TVアニメ「BAKUMATSUクライシス」の公式ホームページです。TBS,BS-TBSにて2019年4月4日放送開始"
933,フルーツバスケット,https://fruba.jp/,全世界コミックス発行累計3000万部！世界中の人々のこころをつかんだ、「フルーツバスケット」が全編アニメ化決定！テレビ東京・テレビ大阪ほかにて2019年4月5日（金）から放送開始。原作：高屋奈月、監督：井端義秀、シリーズ構成：岸本 卓、キャラクターデザイン：進藤 優、アニメーション制作：トムス・エンタテインメント、キャスト：石見舞菜香、島﨑信長、内田雄馬、中村悠一ほか,"フルーツバスケット,フルバ,アニメ,高屋奈月,石見舞菜香,島﨑信長,内田雄馬,中村悠一",,TVアニメ「フルーツバスケット」公式サイト,website,https://fruba.jp,https://fruba.jp/assets/siteinfo/og_image.jpg?1905,TVアニメ「フルーツバスケット」公式サイト,全世界コミックス発行累計3000万部！世界中の人々のこころをつかんだ、「フルーツバスケット」が全編アニメ化決定！テレビ東京・テレビ大阪ほかにて2019年4月5日（金）から放送開始。原作：高屋奈月、監督：井端義秀、シリーズ構成：岸本 卓、キャラクターデザイン：進藤 優、アニメーション制作：トムス・エンタテインメント、キャスト：石見舞菜香、島﨑信長、内田雄馬、中村悠一ほか
934,川柳少女,http://senryu-girl-official.com/,週刊少年マガジン連載の、五七五の１７音で紡がれる日常「川柳少女」TVアニメ化決定！,川柳少女、川柳、マガジン、少年マガジン、週刊少年マガジン、せんりゅう、雪白七々子、七々子、ななこ、575、五七五、775、花澤香菜、花澤、香菜、はなざわ、はなざわかな、五十嵐正邦、CONNECT、コネクト、神保昌登、橋本真希、講談社、毒島エイジ、エイジ、毒島、ぶすじま,,TVアニメ「川柳少女」公式サイト,website,http://senryu-girl-official.com/,/images/fb_image.png,TVアニメ「川柳少女」公式サイト,週刊少年マガジン連載の、五七五の１７音で紡がれる日常「川柳少女」TVアニメ化決定！
935,みだらな青ちゃんは勉強ができない,http://aochan-anime.com/,「少年マガジンエッジ」にて好評連載中！カワハラ恋による妄想ラブコメディ『みだらな青ちゃんは勉強ができない』TVアニメ化決定！,"淫らな青ちゃんは勉強ができない,みだらな青ちゃんは勉強ができない,みだらな青ちゃん,青ちゃん,あおちゃん,少年マガジンエッジ,マガジンエッジ,マガジン,堀江青,堀江,青,カワハラ恋,井上圭介,横手美智子,大島美和,SILVER LINK,シルバーリンク,シルリン,講談社,木嶋拓海,木嶋,リア充,勉強",,TVアニメ「みだらな青ちゃんは勉強ができない」公式サイト,website,http://aochan-anime.com/,/images/fb_image.png,TVアニメ「みだらな青ちゃんは勉強ができない」公式サイト,「少年マガジンエッジ」にて好評連載中！カワハラ恋による妄想ラブコメディ『みだらな青ちゃんは勉強ができない』TVアニメ化決定！
936,ひとりぼっちの○○生活,http://hitoribocchi.jp/,「コミック電撃だいおうじ」にて大好評連載中の『ひとりぼっちの○○生活』がアニメ化！ぼっち少女による“脱”ぼっちコメディー。2019年4月、TVアニメ放送開始！,,,,,,,,
937,MIX,https://www.ytv.co.jp/mix/,ＭＩＸ（ミックス）,"読売テレビ, ytv, ＭＩＸ（ミックス）",,ＭＩＸ（ミックス）｜読売テレビ,website,https://www.ytv.co.jp/mix/,https://www.ytv.co.jp/mix/SNS.jpg,ＭＩＸ（ミックス）｜読売テレビ,ＭＩＸ（ミックス） 2019年4月6日毎週土曜 夕方5時30分スタート！
938,超可動ガール1/6,http://choukadou-anime.com/,「月刊アクション」にて2016年まで連載されていたÖYSTERによる超身長差ラブコメ『超可動ガール1/6』が2019年4月にTVアニメ化決定！,"月刊アクション,ÖYSTER,ノーナ,超可動,春人,フィギュア,ベルノア",,TVアニメ『超可動ガール1/6』公式サイト,website,http://choukadou-anime.com/,http://choukadou-anime.com/wp/wp-content/themes/choukadou/img/ogp.png,TVアニメ『超可動ガール1/6』公式サイト,「月刊アクション」にて2016年まで連載されていたÖYSTERによる超身長差ラブコメ『超可動ガール1/6』が2019年4月にTVアニメ化決定！
939,女子かう生,http://joshikau-anime.com/,WEBコミックアクションにて連載中のひと言もしゃべらないJKコメディ「女子かう生」がTVアニメ化決定！2019年4月より放送開始！,"女子かう生,WEBコミックアクション,若井ケン,富戸もも子,立花理香,渋沢しぶみ,嶺内ともみ,古井まゆみ,久保ユリカ",,TVアニメ『女子かう生』公式サイト,website,http://joshikau-anime.com,http://joshikau-anime.com/wp/wp-content/themes/joshikau/img/ogp.jpg,TVアニメ『女子かう生』公式サイト,WEBコミックアクションにて連載中のひと言もしゃべらないJKコメディ「女子かう生」がTVアニメ化決定！2019年4月より放送開始！
940,ノブナガ先生の幼な妻,http://nobutsuma-anime.com/,「月刊アクション」にて好評連載中、紺野あずれによる戦国系ラブコメ『ノブナガ先生の幼な妻』、2019年4月アニメ化決定！,"月刊アクション,紺野あずれ,ノブナガ先生,ノブナガ,戦国,帰蝶,吉乃,上原あかり,酒井広大,小澤亜李",,TVアニメ『ノブナガ先生の幼な妻』公式サイト,website,http://nobutsuma-anime.com,http://nobutsuma-anime.com/wp/wp-content/themes/nobutsuma/img/ogp.jpg,TVアニメ『ノブナガ先生の幼な妻』公式サイト,「月刊アクション」にて好評連載中、紺野あずれによる戦国系ラブコメ『ノブナガ先生の幼な妻』、2019年4月アニメ化決定！
941,鬼滅の刃,https://kimetsu.com/anime/,「己を滅して 鬼を斬れ──」週刊少年ジャンプ連載の大人気漫画「鬼滅の刃」2019年4月6日より放送開始！,"吾峠呼世晴,鬼滅の刃,TVアニメ,集英社,少年ジャンプ,きめつのやいば",Aniplex Inc.,TVアニメ「鬼滅の刃」公式サイト,website,https://kimetsu.com/anime/,https://kimetsu.com/anime/assets/ogp.png,,「己を滅して 鬼を斬れ──」週刊少年ジャンプ連載の大人気漫画「鬼滅の刃」2019年4月6日より放送開始！
942,続・終物語＆「〈物語〉シリーズ」セレクション,https://www.monogatari-series.com/zokuowarimonogatari/,「続・終物語」5月18日(土)24:00より全6話放送！僕達と、育ち続ける物語。,"西尾維新,新房昭之,渡辺明夫,終物語,物語シリーズ,アニプレックス,講談社,阿良々木暦,神谷浩史",,「続・終物語」公式サイト,website,https://www.monogatari-series.com/zokuowarimonogatari/,https://www.monogatari-series.com/zokuowarimonogatari/og1904.png,「続・終物語」公式サイト,「続・終物語」5月18日(土)24:00より全6話放送！僕達と、育ち続ける物語。
943,ぼくたちは勉強ができない,https://boku-ben.com/,TVアニメ「ぼくたちは勉強ができない」2019年4月6日(土)24:30より放送開始！,"ぼくたちは勉強ができない, 筒井大志, ジャンプ, 週刊少年ジャンプ, ぼく勉, アニメ, 集英社, アニプレックス, ANIPLEX",,TVアニメ「ぼくたちは勉強ができない」公式サイト,website,https://boku-ben.com/,https://boku-ben.com/og.png,TVアニメ「ぼくたちは勉強ができない」公式サイト,TVアニメ「ぼくたちは勉強ができない」2019年4月6日(土)24:30より放送開始！
944,この音とまれ！,http://www.konooto-anime.jp/,TVアニメ『この音とまれ！』公式サイト。累計300万部突破の大注目コミックス「この音とまれ！」（集英社『ジャンプSQ.』連載中）が待望のTVアニメ化決定！,"この音とまれ,ジャンプSQ,箏,龍星群,久遠,さとわ,武蔵,久遠愛,TVアニメ化,大人気コミック",,TVアニメ『この音とまれ！』公式サイト,website,http://konooto-anime.jp/,http://konooto-anime.jp/img/common/ogp3.jpg,TVアニメ『この音とまれ！』公式サイト,TVアニメ『この音とまれ！』公式サイト。累計300万部突破の大注目コミックス「この音とまれ！」（集英社『ジャンプSQ.』連載中）が待望のTVアニメ化決定！
945,ゲゲゲの鬼太郎 地獄の四将編,http://www.toei-anim.co.jp/kitaro/,フジテレビほかにて毎週日曜あさ9時より放送中！！2018年は「ゲゲゲの鬼太郎」アニメ化50周年のアニバーサリーイヤー！鬼太郎役に沢城みゆき＆新たな目玉おやじ役に野沢雅子！,"ゲゲゲの鬼太郎,水木しげる,東映アニメーション,妖怪,妖怪ウォッチ,鬼太郎,ゲゲゲ,目玉親父,目玉おやじ,50周年,沢城みゆき,野沢雅子,古川登志夫,庄司宇芽香,藤井ゆきよ,田中真弓,島田敏,山口勝平",,新番組「ゲゲゲの鬼太郎」-東映アニメーション,website,http://www.toei-anim.co.jp/kitaro/,http://www.toei-anim.co.jp/kitaro/og4.png,新番組「ゲゲゲの鬼太郎」-東映アニメーション,フジテレビほかにて毎週日曜あさ9時より放送中！！2018年は「ゲゲゲの鬼太郎」アニメ化50周年のアニバーサリーイヤー！鬼太郎役に沢城みゆき＆新たな目玉おやじ役に野沢雅子！
946,キラッとプリ☆チャン シーズン2,https://www.tv-tokyo.co.jp/anime/prichan/,毎週日曜ごぜん10:00～テレビ東京系6局ネットにて好評放送中！BSテレ東 毎週火曜ゆうがた5時29分～好評放送中！　キラッとプリ☆チャンのテレビ東京アニメ公式サイトです。最新の情報やストーリー、キャラクターやスタッフなどの情報を掲載しています。,"キラッとプリ☆チャン,プリチャン,キラプリ,テレビ東京,あにてれ,アニメ,公式",,キラッとプリ☆チャン　テレビ東京アニメ公式,website,https://www.tv-tokyo.co.jp/anime/prichan/,https://www.tv-tokyo.co.jp/anime/prichan/images/facebook_icon.jpg,,
947,群青のマグメル,http://gunjyo-magumeru.com/,TVアニメ『群青のマグメル』の公式ホームページです。原作は「少年ジャンプ＋」（集英社）にて好評連載中！！,"群青のマグメル,ジャンプ,河西健吾,M・A・O,山村響,森川智之,第年秒,バトル,因又,拾因,ゼロ,ジャンプ＋,富樫義博,集英社",,TVアニメ「群青のマグメル」公式サイト,article,http://gunjyo-magumeru.com/,http://gunjyo-magumeru.com/images/sb_fbsum.jpg,,TVアニメ『群青のマグメル』の公式ホームページです。原作は「少年ジャンプ＋」（集英社）にて好評連載中！！
948,消滅都市,https://shoumetsutoshi-anime.com/,記憶は、生きつづける。TVアニメ「消滅都市」2019年4月放送開始。最新情報など公開しています。,"消滅都市,GREE,マッドハウス,杉田智和,花澤香菜,中村悠一",消滅都市製作委員会,TVアニメ「消滅都市」オフィシャルサイト,website,https://shoumetsutoshi-anime.com/,https://shoumetsutoshi-anime.com/img/ogp_2.jpg?2,TVアニメ「消滅都市」オフィシャルサイト,記憶は、生きつづける。TVアニメ「消滅都市」2019年4月放送開始。最新情報など公開しています。
949,Fairy goneフェアリーゴーン,http://www.fairygone.com,お前は何を守る。そこには何が残る――。オリジナルTVアニメーション『Fairy gone フェアリーゴーン』2019年4月7日（日）より、TOKYO MXほかにて放送開始！,"Fairy gone,フェアリーゴーン,妖精,鈴木健一,十文字青,中田春彌,清水貴子,(K)NoW_NAME,P.A.WORKS,市ノ瀬加那,前野智昭,福原綾香,細谷佳正,Five fairy scholars,TOHO animation RECORDS",,TVアニメ「Fairy gone フェアリーゴーン」公式サイト,website,https://fairygone.com/,https://fairygone.com/images/ogp2.png,TVアニメ「Fairy gone フェアリーゴーン」公式サイト,お前は何を守る。そこには何が残る――。オリジナルTVアニメーション『Fairy gone フェアリーゴーン』2019年4月7日（日）より、TOKYO MXほかにて放送開始！
950,洗い屋さん！～俺とアイツが女湯で!?～,https://araiya.cf-anime.com/,"TVアニメ「洗い屋さん！～俺とアイツが女湯で！？～」公式サイト。広告で話題沸騰！電子コミック業界で大人気の恋愛お風呂漫画!!
トヨ原作の大人気デジタルコミックが待望のアニメ化！ TOKYO MX、ComicFesta animeにて2019年4月放送開始！",,,TVアニメ「洗い屋さん！～俺とアイツが女湯で！？～」公式,website,,https://araiya.cf-anime.com/wp-content/themes/araiya/img/og_image.jpg,TVアニメ「洗い屋さん！～俺とアイツが女湯で！？～」公式,広告で話題沸騰！電子コミック業界で大人気の恋愛お風呂漫画!!トヨ原作の大人気デジタルコミックが待望のアニメ化！2019年4月放送開始！
951,真夜中のオカルト公務員,http://occultkoumuin.com/,TOKYO MXほかにて4月7日(水)24:30～放送開始！原作：たもつ葉子、監督：渡邉哲哉、アニメーション制作：ライデンフィルム。 テレビアニメ「真夜中のオカルト公務員」公式サイト,,,,,,,,
952,なんでここに先生が!?,http://nankoko-anime.com/,「なんでここに!?」というシチュエーションで展開される魅力的な先生と男子高校生のドキドキラブ・コメディ！「なんでここに先生が!?」のTVアニメ公式ページです。,"アニメ,漫画,マンガ,なんでここに先生が!?",,TVアニメ「なんでここに先生が!?」公式サイト,website,http://nankoko-anime.com,http://nankoko-anime.com/wp/wp-content/themes/nankoko/img/ogp.png,,「なんでここに!?」というシチュエーションで展開される魅力的な先生と男子高校生のドキドキラブ・コメディ！「なんでここに先生が!?」のTVアニメ公式ページです。
953,八月のシンデレラナイン,https://anime-hachinai.com/,TVアニメ「八月のシンデレラナイン」（ハチナイ）2019年放送決定！世界で一番あつい夏がはじまるーー,"ハチナイ,アニメ,八月のシンデレラナイン,８月のシンデレラナイン,TVアニメ",,TVアニメ「八月のシンデレラナイン」公式サイト,website,https://anime-hachinai.com/,https://anime-hachinai.com/anime-assets/img/global/ogp.png,TVアニメ「八月のシンデレラナイン」公式サイト,TVアニメ「八月のシンデレラナイン」2019年放送決定！世界で一番あつい夏がはじまるーー
954,ジモトがジャパン,https://www.shopro.co.jp/tv/jimoto-anime/,原作：林聖二（集英社「週刊少年ジャンプ」連載中）のアニメ「ジモトがジャパン」公式サイト。テレビ東京系列「おはスタ」内の新コーナー「きゃらスタ」にて 毎週月曜日あさ7時5分から放送中！！「おはスタ」毎週月～金あさ7時5分よりテレビ東京系列で放送中！,,,アニメ「ジモトがジャパン」公式サイト,website,https://www.shopro.co.jp/tv/jimoto-anime/index.html,https://www.shopro.co.jp/tv/jimoto-anime/image/image.jpg,アニメ「ジモトがジャパン」公式サイト,原作：林聖二（集英社「週刊少年ジャンプ」連載中）のアニメ「ジモトがジャパン」公式サイト。テレビ東京系列「おはスタ」内の新コーナー「きゃらスタ」にて 毎週月曜日あさ7時5分から放送中！！「おはスタ」毎週月～金あさ7時5分よりテレビ東京系列で放送中！
955,なむあみだ仏っ！-蓮台 UTENA-,https://namuami-utena-anime.com/,TVアニメ「なむあみだ仏っ！- 蓮台 UTENA -」の公式ホームページです。あの人気ゲーム「なむあみだ仏っ！」がアニメ化！TVアニメ「なむあみだ仏っ！- 蓮台 UTENA -」2019年4月放送開始予定！仏たちの和やかな日常や熱き戦いをアニメでもお見逃しなく！,,,TVアニメ「なむあみだ仏っ！- 蓮台 UTENA -」公式サイト,website,https://namuami-utena-anime.com,https://namuami-utena-anime.com/wp-content/themes/namuamianime_v9/ogp.jpg,TVアニメ「なむあみだ仏っ！- 蓮台 UTENA -」公式サイト,TVアニメ「なむあみだ仏っ！- 蓮台 UTENA -」の公式ホームページです。あの人気ゲーム「なむあみだ仏っ！」がアニメ化！TVアニメ「なむあみだ仏っ！- 蓮台 UTENA -」2019年4月放送開始予定！仏たちの和やかな日常や熱き戦いをアニメでもお見逃しなく！
956,RobiHachi,https://robihachi.jp/,TVアニメ「RobiHachi」公式ホームページ！,"ロビハチ,RobiHachi",,TVアニメ「RobiHachi」公式サイト,website,https://robihachi.jp/,https://robihachi.jp/img/ogp_02.jpg,TVアニメ「RobiHachi」公式サイト,TVアニメ「RobiHachi」公式ホームページ！
